{
  "account_id": "ACC001",
  "company_name": "Springfield Fire Protection",
  "version": "v1",
  "business_hours": {
    "timezone": null,
    "schedule": [
      {
        "days": [
          "Monday",
          "Tuesday",
          "Wednesday",
          "Thursday",
          "Friday"
        ],
        "open": "08:00",
        "close": "17:00"
      }
    ]
  },
  "office_address": "123 Main Street, Springfield, Illinois",
  "services_supported": [
    "fire sprinkler installations",
    "fire alarm systems",
    "fire alarm inspections",
    "fire alarm maintenance"
  ],
  "emergency_definition": [
    "sprinkler leaks",
    "fire alarms going off",
    "system failures"
  ],
  "emergency_routing_rules": {
    "primary_contact": "on-call technician",
    "transfer_number": "555-0100",
    "transfer_timeout_seconds": 60,
    "fallback_action": "promise callback within 15 minutes"
  },
  "non_emergency_routing_rules": {
    "action": "transfer to dispatch department",
    "transfer_number": null
  },
  "call_transfer_rules": {
    "timeout_seconds": 60,
    "max_retries": 1,
    "failure_message": null
  },
  "integration_constraints": [
    "never create sprinkler jobs in ServiceTrade"
  ],
  "after_hours_flow_summary": null,
  "office_hours_flow_summary": null,
  "questions_or_unknowns": [
    "exact after-hours transfer protocol unclear",
    "false alarm handling protocol not specified"
  ],
  "notes": null
}